{
  "run_id": "run_20241215_130000",
  "run_label": "MobileNetV2 Transfer Learning for Image Classification",
  "dataset": "images_fashion_mnist_001",
  "dataset_type": "image",
  "model": "MobileNetV2",
  "epochs": 30,
  "batch_size": 64,
  "learning_rate": 0.0001,
  "class_balancing": true,
  "early_stopping": true,
  "early_stopping_patience": 8,
  "use_mlflow": true,
  "validation_split": 0.2,
  "test_split": 0.2,
  "random_seed": 42,
  "gpu_device": 0,
  "model_params": {
    "trainable_layers": 20,
    "dropout_rate": 0.2
  },
  "augmentation": {
    "rotation": true,
    "horizontal_flip": true,
    "brightness": true,
    "contrast": true,
    "jitter": false,
    "speed_scale": false
  },
  "preprocessing": {
    "scale_normalize": true
  },
  "callbacks": {
    "checkpoint_monitor": "val_accuracy",
    "reduce_lr_patience": 3,
    "reduce_lr_factor": 0.2
  },
  "export": {
    "save_weights_only": false,
    "export_tflite": true,
    "export_onnx": true,
    "tflite_quantization": "int8"
  },
  "metadata": {
    "timestamp": "2024-12-15T13:00:00Z",
    "git_commit": "def67890",
    "description": "Transfer learning using MobileNetV2 pre-trained on ImageNet. Fine-tuning top 20 layers for fashion item classification. Includes data augmentation for improved generalization.",
    "tags": ["transfer-learning", "mobilenet", "image-classification", "fashion-mnist"]
  }
}
